{
  "schema": "zubrilina_murmuration/1",
  "generated_by": "fb3f46c-dirty",
  "params": {"family": "square-free levels N, weight 2, trivial character, Γ₀(N) newforms", "statistic": "short interval (Z25 Theorem 1, k=2): [Σ□_{N∈[X,X+Y]} Σ_f a_f(P)ε(f)] / [Σ□ dim S₂^new(N)] → M₂(y), y=P/X, one point per prime P", "source": "Zubrilina arXiv:2310.07681, Theorem 1", "external_data": "none — from scratch (Hurwitz class numbers → Eichler–Selberg trace formula → averaged; dim via genus/Möbius); ARCHITECTURE-M §9 repo-reproducible default", "provenance": "empirical = class-number trace formula per level (computed); density M₂ = Euler-product formula (computed); both sides authored as separate TUs", "X": 1800, "window_Y": 190, "y_max": 2.35, "n_levels": 113, "n_primes": 579, "max_hurwitz_arg": 33662840, "y_axis": "y = P/X", "l2_note": "L2 ≈ 0.45 at X=1800 is the EXPECTED order, not weak evidence: a short-interval window holds only ~10² exact newform traces, so per-prime scatter dominates the finite-X deviation from M₂. The calibrated pass/fail is the PRE-COMMITTED teeth at y=n²/4 (matched to {0.000,0.010,0.040}); the L2 magnitude is only the supporting convergence empiric, and it decreases with X (0.551→0.450)."},
  "empirical": [{"y": 0.00111111111111, "p": 2, "emp": 0.151521216974, "m2": 0.243157213013, "resid": -0.0916359960394},{"y": 0.00166666666667, "p": 3, "emp": 0.226693885487, "m2": 0.292595665594, "resid": -0.065901780107},{"y": 0.00277777777778, "p": 5, "emp": 0.330367788682, "m2": 0.367073591422, "resid": -0.0367058027399},{"y": 0.00388888888889, "p": 7, "emp": 0.39804964539, "m2": 0.424069395361, "resid": -0.0260197499711},{"y": 0.00611111111111, "p": 11, "emp": 0.476762888343, "m2": 0.510541969673, "resid": -0.0337790813293},{"y": 0.00722222222222, "p": 13, "emp": 0.516867265638, "m2": 0.545158890011, "resid": -0.028291624373},{"y": 0.00944444444444, "p": 17, "emp": 0.578862341638, "m2": 0.603218078344, "resid": -0.0243557367066},{"y": 0.0105555555556, "p": 19, "emp": 0.601936925751, "m2": 0.627988261384, "resid": -0.0260513356328},{"y": 0.0127777777778, "p": 23, "emp": 0.657456724368, "m2": 0.671106473382, "resid": -0.0136497490146},{"y": 0.0161111111111, "p": 29, "emp": 0.712748614281, "m2": 0.723540394219, "resid": -0.0107917799383},{"y": 0.0172222222222, "p": 31, "emp": 0.703899698771, "m2": 0.738452610374, "resid": -0.0345529116038},{"y": 0.0205555555556, "p": 37, "emp": 0.759308834266, "m2": 0.777110609286, "resid": -0.0178017750198},{"y": 0.0227777777778, "p": 41, "emp": 0.763986721723, "m2": 0.798625690502, "resid": -0.0346389687795},{"y": 0.0238888888889, "p": 43, "emp": 0.777465692962, "m2": 0.808296028066, "resid": -0.0308303351042},{"y": 0.0261111111111, "p": 47, "emp": 0.814320585842, "m2": 0.825707039778, "resid": -0.0113864539361},{"y": 0.0294444444444, "p": 53, "emp": 0.8793272371, "m2": 0.847585464142, "resid": 0.0317417729579},{"y": 0.0327777777778, "p": 59, "emp": 0.863883259019, "m2": 0.865123756156, "resid": -0.00124049713676},{"y": 0.0338888888889, "p": 61, "emp": 0.792282231372, "m2": 0.870122063164, "resid": -0.0778398317922},{"y": 0.0372222222222, "p": 67, "emp": 0.859787508049, "m2": 0.882854447408, "resid": -0.0230669393595},{"y": 0.0394444444444, "p": 71, "emp": 0.881854516387, "m2": 0.889624449457, "resid": -0.00776993307041},{"y": 0.0405555555556, "p": 73, "emp": 0.850015989767, "m2": 0.892537893729, "resid": -0.0425219039622},{"y": 0.0438888888889, "p": 79, "emp": 0.874879382438, "m2": 0.899541530108, "resid": -0.0246621476702},{"y": 0.0461111111111, "p": 83, "emp": 0.886155837851, "m2": 0.902872358853, "resid": -0.0167165210021},{"y": 0.0494444444444, "p": 89, "emp": 0.897157123299, "m2": 0.906050374035, "resid": -0.00889325073654},{"y": 0.0538888888889, "p": 97, "emp": 0.890139938877, "m2": 0.907226198002, "resid": -0.0170862591244},{"y": 0.0561111111111, "p": 101, "emp": 0.891213389121, "m2": 0.906624248111, "resid": -0.0154108589892},{"y": 0.0572222222222, "p": 103, "emp": 0.901335908579, "m2": 0.906046593988, "resid": -0.00471068540946},{"y": 0.0594444444444, "p": 107, "emp": 0.881974593986, "m2": 0.904364411947, "resid": -0.0223898179612},{"y": 0.0605555555556, "p": 109, "emp": 0.88756635033, "m2": 0.90326973433, "resid": -0.0157033840001},{"y": 0.0627777777778, "p": 113, "emp": 0.910539018504, "m2": 0.900596161169, "resid": 0.00994285733441},{"y": 0.0705555555556, "p": 127, "emp": 0.871318822023, "m2": 0.886576752816, "resid": -0.0152579307933},{"y": 0.0727777777778, "p": 131, "emp": 0.859258067112, "m2": 0.881356147322, "resid": -0.0220980802103},{"y": 0.0761111111111, "p": 137, "emp": 0.907768542199, "m2": 0.872604849087, "resid": 0.0351636931126},{"y": 0.0772222222222, "p": 139, "emp": 0.828388974214, "m2": 0.869453123988, "resid": -0.0410641497745},{"y": 0.0827777777778, "p": 149, "emp": 0.900080450523, "m2": 0.852044843744, "resid": 0.0480356067792},{"y": 0.0838888888889, "p": 151, "emp": 0.858384293531, "m2": 0.84824892131, "resid": 0.0101353722208},{"y": 0.0872222222222, "p": 157, "emp": 0.83202162334, "m2": 0.836269611003, "resid": -0.00424798766209},{"y": 0.0905555555556, "p": 163, "emp": 0.794339772637, "m2": 0.823442062156, "resid": -0.0291022895194},{"y": 0.0927777777778, "p": 167, "emp": 0.848898890854, "m2": 0.814442220586, "resid": 0.0344566702676},{"y": 0.0961111111111, "p": 173, "emp": 0.815053071727, "m2": 0.800302075188, "resid": 0.0147509965391},{"y": 0.0994444444444, "p": 179, "emp": 0.836068211068, "m2": 0.785428660797, "resid": 0.0506395502715},{"y": 0.100555555556, "p": 181, "emp": 0.774121405751, "m2": 0.780314316982, "resid": -0.00619291123131},{"y": 0.106111111111, "p": 191, "emp": 0.802940706409, "m2": 0.753625381367, "resid": 0.0493153250418},{"y": 0.107222222222, "p": 193, "emp": 0.728347714925, "m2": 0.748072406945, "resid": -0.0197246920205},{"y": 0.109444444444, "p": 197, "emp": 0.776534526854, "m2": 0.736760158076, "resid": 0.0397743687783},{"y": 0.110555555556, "p": 199, "emp": 0.757871184274, "m2": 0.731002978181, "resid": 0.0268682060928},{"y": 0.117222222222, "p": 211, "emp": 0.673026472693, "m2": 0.695107100091, "resid": -0.0220806273985},{"y": 0.123888888889, "p": 223, "emp": 0.724381906352, "m2": 0.657032283582, "resid": 0.0673496227702},{"y": 0.126111111111, "p": 227, "emp": 0.681135225376, "m2": 0.643887162998, "resid": 0.0372480623772},{"y": 0.127222222222, "p": 229, "emp": 0.625009937197, "m2": 0.637232959528, "resid": -0.0122230223314},{"y": 0.129444444444, "p": 233, "emp": 0.672708482391, "m2": 0.623764808454, "resid": 0.0489436739377},{"y": 0.132777777778, "p": 239, "emp": 0.649495190397, "m2": 0.603173397263, "resid": 0.0463217931337},{"y": 0.133888888889, "p": 241, "emp": 0.567930678114, "m2": 0.596208424866, "resid": -0.0282777467513},{"y": 0.139444444444, "p": 251, "emp": 0.644407345576, "m2": 0.560652562456, "resid": 0.0837547831198},{"y": 0.142777777778, "p": 257, "emp": 0.655696001272, "m2": 0.538755134914, "resid": 0.116940866358},{"y": 0.146111111111, "p": 263, "emp": 0.55559125964, "m2": 0.516452811398, "resid": 0.0391384482422},{"y": 0.149444444444, "p": 269, "emp": 0.496303439409, "m2": 0.493759371341, "resid": 0.00254406806798},{"y": 0.150555555556, "p": 271, "emp": 0.517197042752, "m2": 0.486110246938, "resid": 0.0310867958137},{"y": 0.153888888889, "p": 277, "emp": 0.512218649518, "m2": 0.462915440332, "resid": 0.0493032091859},{"y": 0.156111111111, "p": 281, "emp": 0.530471136839, "m2": 0.447250496008, "resid": 0.0832206408307},{"y": 0.157222222222, "p": 283, "emp": 0.406817816369, "m2": 0.439358796546, "resid": -0.0325409801763},{"y": 0.162777777778, "p": 293, "emp": 0.494792908816, "m2": 0.39932446572, "resid": 0.0954684430967},{"y": 0.170555555556, "p": 307, "emp": 0.322796934866, "m2": 0.341734191306, "resid": -0.01893725644},{"y": 0.172777777778, "p": 311, "emp": 0.400287402203, "m2": 0.324964540319, "resid": 0.0753228618848},{"y": 0.173888888889, "p": 313, "emp": 0.373084291188, "m2": 0.31652886512, "resid": 0.0565554260678},{"y": 0.176111111111, "p": 317, "emp": 0.39964873064, "m2": 0.299557432208, "resid": 0.100091298432},{"y": 0.183888888889, "p": 331, "emp": 0.283775151709, "m2": 0.239138939521, "resid": 0.0446362121879},{"y": 0.187222222222, "p": 337, "emp": 0.238333730821, "m2": 0.212777910458, "resid": 0.0255558203629},{"y": 0.192777777778, "p": 347, "emp": 0.246124493203, "m2": 0.16824717693, "resid": 0.0778773162726},{"y": 0.193888888889, "p": 349, "emp": 0.159790126401, "m2": 0.159254008671, "resid": 0.000536117730097},{"y": 0.196111111111, "p": 353, "emp": 0.264726925829, "m2": 0.141182641228, "resid": 0.1235442846},{"y": 0.199444444444, "p": 359, "emp": 0.172827728754, "m2": 0.113866600707, "resid": 0.0589611280474},{"y": 0.203888888889, "p": 367, "emp": 0.131824020552, "m2": 0.077064799691, "resid": 0.0547592208614},{"y": 0.207222222222, "p": 373, "emp": 0.130399871527, "m2": 0.0491858925261, "resid": 0.0812139790011},{"y": 0.210555555556, "p": 379, "emp": 0.0401541920977, "m2": 0.0210754373638, "resid": 0.0190787547339},{"y": 0.212777777778, "p": 383, "emp": 0.141182139415, "m2": 0.00220920984057, "resid": 0.138972929575},{"y": 0.216111111111, "p": 389, "emp": 0.106987951807, "m2": -0.0262750924328, "resid": 0.13326304424},{"y": 0.220555555556, "p": 397, "emp": -0.0414591033264, "m2": -0.0645914951442, "resid": 0.0231323918178},{"y": 0.222777777778, "p": 401, "emp": -0.0243262580491, "m2": -0.0838909880343, "resid": 0.0595647299852},{"y": 0.227222222222, "p": 409, "emp": -0.11781540663, "m2": -0.122765561689, "resid": 0.00495015505859},{"y": 0.232777777778, "p": 419, "emp": -0.0802925510772, "m2": -0.171861733528, "resid": 0.0915691824507},{"y": 0.233888888889, "p": 421, "emp": -0.100166944908, "m2": -0.181746419246, "resid": 0.0815794743382},{"y": 0.239444444444, "p": 431, "emp": -0.190476190476, "m2": -0.231488643648, "resid": 0.0410124531717},{"y": 0.240555555556, "p": 433, "emp": -0.169647825741, "m2": -0.241499808489, "resid": 0.071851982748},{"y": 0.243888888889, "p": 439, "emp":